{
  "$schema": "./db.schema.json",
  "schemaVersion": 3,
  "caseStudies": [
    {
      "id": "loopwell-the-space-for-well-being",
      "slug": "loopwell-the-space-for-well-being",
      "title": "Loopwell: The Space for Well-being",
      "tags": [
        "Art Direction",
        "Brand Design",
        "Web Design",
        "Motion Design",
        "Video Editing",
        "Campaign Design",
        "Event Content"
      ],
      "publishedAt": "2025-12-02",
      "updatedAt": "2026-10-05",
      "visibility": "public",
      "client": {
        "name": "Loopwell",
        "logo": {
          "id": "loopwell-the-space-for-well-being-client-logo",
          "type": "image",
          "src": "https://cdn.mikeangelo.art/loopwell-the-space-for-well-being/keypoint-media/loopwell-logo.png",
          "alt": "Loopwell logo with circular pattern",
          "width": 350,
          "height": 355
        }
      },
      "cover": {
        "id": "loopwell-the-space-for-well-being-cover",
        "type": "image",
        "src": "https://cdn.mikeangelo.art/loopwell-the-space-for-well-being/cover.webp",
        "alt": "Loopwell meditation room interior showing serene design and calming atmosphere",
        "width": 1500,
        "height": 1000
      },
      "objective": "Loopwell was turning an empty building in Montclair, New Jersey into a wellness and event space. The brand and website needed to introduce the space and support events, memberships, reservations, and payments.",
      "intro": [
        "I helped develop Loopwell's visual identity and created its promotional materials, video edits and motion assets. I designed and implemented landing pages and helped design and develop the event and membership website, adding custom integrations and scripts around its operational needs. Event teams, instructors and wellness partners contributed to the productions and experiences this work supported."
      ],
      "contribution": {
        "role": "Art Director & Designer",
        "summary": "I helped develop Loopwell's logo and visual identity, designed promotional materials and landing pages, edited video, and created motion and paid social ads.",
        "responsibilities": [
          "Logo and visual identity development",
          "Promotional visual design",
          "Landing page design and implementation",
          "Video editing and motion design",
          "Paid social ad creative",
          "Website design, custom integrations and scripts"
        ],
        "collaborators": [
          "Loopwell founders and creative team",
          "Event and production teams",
          "Wellness instructors and partner organizations"
        ],
        "deliverables": [
          "Brand and promotional materials",
          "Event, membership and e-commerce website",
          "Landing pages",
          "Event films, motion and social ads"
        ]
      },
      "results": [
        {
          "value": "10+ events per week",
          "label": "Reported venue programming"
        },
        {
          "value": "Brand, website, and event content",
          "label": "Connected launch materials"
        }
      ],
      "hero": {
        "id": "loopwell-the-space-for-well-being-loopwell-brand-video",
        "type": "video",
        "src": "https://video.gumlet.io/693618f203bcee22ddeecad9/693622dc7d19d07028497caa/main.mp4",
        "alt": "Loopwell brand video teaser showcasing wellness spaces and community events",
        "title": "Loopwell Brand Video",
        "caption": "Brand video introducing Loopwell's well-being space and community, created for the brand's soft launch.",
        "client": "Loopwell"
      },
      "featuredMediaIds": [
        "loopwell-the-space-for-well-being-loopwell-logos",
        "loopwell-the-space-for-well-being-loopwell-6",
        "loopwell-the-space-for-well-being-loopwell-wall",
        "loopwell-the-space-for-well-being-corp-gif"
      ],
      "sections": [
        {
          "id": "breaking-ground-on-the-brand",
          "title": "An identity for a new wellness space",
          "paragraphs": [
            "I helped develop Loopwell's logo and visual identity while the space was taking shape. The final direction drew on nature and human connection, using organic forms to express the brand's focus on well-being. I carried that direction into promotional materials and digital experiences."
          ],
          "media": [
            {
              "id": "loopwell-the-space-for-well-being-loopwell-logos",
              "type": "image",
              "src": "https://cdn.mikeangelo.art/loopwell-the-space-for-well-being/keypoint-media/loopwell-logos.png",
              "alt": "Various naturalistic and organic Loopwell logo concepts",
              "width": 1440,
              "height": 810
            },
            {
              "id": "loopwell-the-space-for-well-being-loopwell-wall",
              "type": "image",
              "src": "https://cdn.mikeangelo.art/loopwell-the-space-for-well-being/keypoint-media/loopwell-wall.png",
              "alt": "Quote wall for Loopwell that says 'All are welcome here. At loop, we work and live responsibly, mindfully and with purpose. To better our companies, communities, families, and ourselves. To be good humans and a force for good in the world.'",
              "width": 1123,
              "height": 1453
            },
            {
              "id": "loopwell-the-space-for-well-being-loopwell-2",
              "type": "image",
              "src": "https://cdn.mikeangelo.art/loopwell-the-space-for-well-being/keypoint-media/loopwell-2.jpg",
              "alt": "Loopwell branding on the large screen in the main space surrounded by plants and large windows",
              "width": 1500,
              "height": 999
            },
            {
              "id": "loopwell-the-space-for-well-being-loopwell-5",
              "type": "image",
              "src": "https://cdn.mikeangelo.art/loopwell-the-space-for-well-being/keypoint-media/loopwell-5.jpg",
              "alt": "Apothecary area at Loopwell with various plant decor and holistic products",
              "width": 2293,
              "height": 1667
            },
            {
              "id": "loopwell-the-space-for-well-being-loopwell-1",
              "type": "image",
              "src": "https://cdn.mikeangelo.art/loopwell-the-space-for-well-being/keypoint-media/loopwell-1.jpg",
              "alt": "Loopwell slogan 'loop with us' on an organic fern backdrop",
              "width": 2500,
              "height": 1406
            }
          ]
        },
        {
          "id": "building-a-powerful-site",
          "title": "Designing the event and membership website",
          "paragraphs": [
            "Loopwell needed to manage weekly events, attendees, memberships, space reservations and payments. I helped design and develop the website, implementing custom design integrations and scripts around those needs. I also designed and implemented landing pages that connected the brand's promotional work to its offerings."
          ],
          "media": [
            {
              "id": "loopwell-the-space-for-well-being-loopwell-6",
              "type": "video",
              "src": "https://cdn.mikeangelo.art/loopwell-the-space-for-well-being/keypoint-media/loopwell-6.mp4",
              "alt": "Video demonstration of Loopwell website event calendar"
            },
            {
              "id": "loopwell-the-space-for-well-being-loopwell-7",
              "type": "image",
              "src": "https://cdn.mikeangelo.art/loopwell-the-space-for-well-being/keypoint-media/loopwell-7.png",
              "alt": "Example of an event registration modal on the Loopwell website",
              "width": 1188,
              "height": 891
            },
            {
              "id": "loopwell-the-space-for-well-being-loopwell-mobile-1",
              "type": "video",
              "src": "https://cdn.mikeangelo.art/loopwell-the-space-for-well-being/keypoint-media/loopwell-mobile-1.mp4",
              "alt": "Video demonstration of the Loopwell website in a mobile window"
            },
            {
              "id": "loopwell-the-space-for-well-being-loopwell-wheel",
              "type": "video",
              "src": "https://cdn.mikeangelo.art/loopwell-the-space-for-well-being/keypoint-media/loopwell-wheel.mp4",
              "alt": "Loopwell wellness wheel custom script"
            },
            {
              "id": "loopwell-the-space-for-well-being-loopwell-9",
              "type": "video",
              "src": "https://cdn.mikeangelo.art/loopwell-the-space-for-well-being/keypoint-media/loopwell-9.mp4",
              "alt": "Video demonstration of Loopwell website capabilities"
            }
          ]
        },
        {
          "id": "a-v-production-and-event-ecosystem",
          "title": "Turning events into film and social content",
          "paragraphs": [
            "I worked with production teams on event filming, live streaming and live production setups, then edited the footage and created motion graphics. I designed promotional materials and paid social ads for Loopwell and its event partners, extending each event into content that could support the wider wellness community."
          ],
          "media": [
            {
              "id": "loopwell-the-space-for-well-being-corp-gif",
              "type": "video",
              "src": "https://cdn.mikeangelo.art/loopwell-the-space-for-well-being/keypoint-media/corp%20gif.mp4",
              "alt": "Corporate wellness event production highlights with professional lighting and setup"
            },
            {
              "id": "loopwell-the-space-for-well-being-sofistafunk-gif",
              "type": "video",
              "src": "https://cdn.mikeangelo.art/loopwell-the-space-for-well-being/keypoint-media/sofistafunk%20gif.mp4",